#fields:Hanzi	Pinyin	English	HSK	Radical	Notes	Tags
也	yě	also; too; classical particle	1	乙	A pictograph that lost its original image entirely and became one of the most load-bearing particles in classical Chinese: the gavel at the end of every verdict.	grammar particle classical syntax adverb
一	yī	one; unified; as soon as	1	一	The simplest mark a brush can make carries the heaviest philosophical weight in Chinese civilization: 道生一，一生二，the Dao generates One, and One generates everything.	cosmology philosophy taoism confucianism
以	yǐ	by means of; using; because; in order to	2	人	A classical Chinese preposition and conjunction so versatile that it anchors half the grammar of formal Chinese: the word that turns one thing into the means, standard, or cause of another.	grammar classical syntax conjunction particle literary
义	yì	righteousness, duty, justice	3	丶	The Confucian virtue of doing what is morally right, and the simplification that erased a sheep, a self, and the entire picture of what righteous form looks like.	confucianism ethics virtue philosophy
用	yòng	to use; function; expense	2	用	用 began as a pictograph of a bucket or bell (a vessel put to work) and became the character that Zhuangzi inverted in his doctrine of 无用之用: the use of uselessness.	daoism philosophy daily-life grammar
有	yǒu	to have, to exist	1	月	Possession, existence, and the have/be distinction that reshapes grammar.	grammar existence possession
右	yòu	right; to assist; to favor	2	口	A right hand raised to a mouth: the hand that feeds and speaks, whose authority in Chinese extended to favoring, protecting, and placing the highest things to the right of the seat.	direction space daily-life
雨	yǔ	rain	2	雨	The oracle bone shows rain falling from the sky: one of the most transparent pictographs in the script, and the radical that organizes all Chinese weather.	nature radical cosmology
语	yǔ	language, speech, words	2	讠	Speech radical plus the phonetic 吾 (I, me): the character for language carries the self within it, encoding the idea that language is the medium through which the self speaks to the world.	grammar culture
玉	yù	jade, precious		玉	The material of kingship and moral cultivation: three jade discs on a cord, a glyph almost identical to king, the stone that Confucius said was virtue made visible.	nature culture virtue confucianism aesthetics royalty classical
远	yuǎn	far, distant, remote	2	辶	Long robes trailing as you walk away: distance encoded in motion, and the ambivalence of far-off places in Chinese thought.	direction geography nature classical analects confucianism
月	yuè	moon, month	1	月	A crescent moon in profile, and one of the most poetically charged characters in Chinese literature.	nature radical poetry time
越	yuè	to cross over, to surpass	2	走	The character of crossing-and-exceeding: a foot-radical verb that travels from "stride over a barrier" to "the more, the more" to a Chinese state name and a national poetic gesture.	movement comparison border
云	yún	cloud	4	二	The simplified 云 is older than the traditional 雲, a rare case where the modern form recovers the ancient one.	nature cosmology classical
再	zài	again, then, further	2	冂	The adverb that sequences and repeats: again, one more time, and the subtle art of "and then."	grammar time
在	zài	to be at, located, in progress	1	土	The character that locates: a seedling rooted in earth, expanded into location, preposition, and progressive aspect.	grammar space aspect
长	cháng	long; to grow; chief	1	长	A person with flowing long hair. One character, two readings: cháng (long) and zhǎng (to grow, elder), the richest dual-reading in Mandarin.	grammar culture family
真	zhēn	real, true, genuine	2	目	Truth not as accuracy but as authenticity: the unadorned thing itself, prized in Daoist self-cultivation and in everyday emphasis.	knowing daoism philosophy virtue
之	zhī	of, going, this: the classical connective	5	丿	The most-written character in classical Chinese: a possessive particle, pronoun, and verb fossilized into pure grammar.	classical grammar particle literary
知	zhī	to know; knowledge	2	矢	知 = arrow + mouth: knowledge as the swift, target-hitting utterance, and in Wang Yangming, the act of knowing is inseparable from the act of doing.	knowing philosophy confucianism education
智	zhì	wisdom, moral intelligence	4	日	The Confucian virtue of knowing what is right to do; separately, the Buddhist prajñā that sees through the nature of things altogether.	confucianism ethics virtue philosophy buddhism
中	zhōng	middle, China, to hit the mark	1	丨	An arrow piercing through the center of a target: the character that names China as the Middle Kingdom and encodes the Confucian virtue of equilibrium.	confucianism culture history philosophy
字	zì	character, written word	1	子	The character that names itself, and the whole system of 汉字.	writing language meta
走	zǒu	to walk, to go, to leave	1	走	A figure in motion with feet below: the basic verb of movement that Chinese uses where English uses dozens of different words.	grammar culture
足	zú	foot; sufficient; enough	4	足	The foot that became the word for sufficiency, and the radical anchoring every character involving legs, running, and roads.	body motion radical
左	zuǒ	left; unorthodox; to assist	2	工	A left hand holding a carpenter's square: the assisting hand at the ruler, and by extension the word for unorthodox, heterodox, and everything that deviates from the orthodox path.	direction space daily-life
